id,name,registry_name,court_type,region,location,address,city,district,latitude,longitude,google_place_id,area_coverage,contact_phone,contact_email,website,court_picture_url,additional_images,operating_hours,is_active,is_verified,created_at,updated_at,created_by,updated_by,search_count,last_searched,notes,status
198,Kete-Krachi District Court,,District Court,Oti,Krachi,"Kete-Krachi District Court, Krachi, Oti",,,6.917828,0.42038,,Jurisdiction covers Krachi and surrounding areas,+233 648 798 201,krachi.court@judicial.gov.gh,https://www.judicial.gov.gh,https://images.unsplash.com/photo-1589829545856-d10d557cf95f?w=500,,"{'monday': '9:00 AM - 5:00 PM', 'tuesday': '9:00 AM - 5:00 PM', 'wednesday': '9:00 AM - 5:00 PM', 'thursday': '9:00 AM - 5:00 PM', 'friday': '9:00 AM - 5:00 PM', 'saturday': '9:00 AM - 1:00 PM', 'sunday': 'Closed'}",True,True,2025-09-18 03:10:03,2025-09-18 03:22:34,,,0,,"Court located in Krachi, Oti region",ACTIVE
200,Dambai District Court,,District Court,Oti,Dambai,"Dambai District Court, Dambai, Oti",,,6.705205,0.571568,,Jurisdiction covers Dambai and surrounding areas,+233 489 791 400,dambai.court@judicial.gov.gh,https://www.judicial.gov.gh,https://images.unsplash.com/photo-1589829545856-d10d557cf95f?w=500,,"{'monday': '9:00 AM - 5:00 PM', 'tuesday': '9:00 AM - 5:00 PM', 'wednesday': '9:00 AM - 5:00 PM', 'thursday': '9:00 AM - 5:00 PM', 'friday': '9:00 AM - 5:00 PM', 'saturday': '9:00 AM - 1:00 PM', 'sunday': 'Closed'}",True,True,2025-09-18 03:10:03,2025-09-18 03:22:34,,,0,,"Court located in Dambai, Oti region",ACTIVE
202,Kadjebi District Court,,District Court,Oti,Kadjebi,"Kadjebi District Court, Kadjebi, Oti",,,7.024866,0.867761,,Jurisdiction covers Kadjebi and surrounding areas,+233 352 960 750,kadjebi.court@judicial.gov.gh,https://www.judicial.gov.gh,https://images.unsplash.com/photo-1589829545856-d10d557cf95f?w=500,,"{'monday': '9:00 AM - 5:00 PM', 'tuesday': '9:00 AM - 5:00 PM', 'wednesday': '9:00 AM - 5:00 PM', 'thursday': '9:00 AM - 5:00 PM', 'friday': '9:00 AM - 5:00 PM', 'saturday': '9:00 AM - 1:00 PM', 'sunday': 'Closed'}",True,True,2025-09-18 03:10:03,2025-09-18 03:22:34,,,0,,"Court located in Kadjebi, Oti region",ACTIVE
204,Chinderi District Court,,District Court,Oti,Chinderi,"Chinderi District Court, Chinderi, Oti",,,6.610373,0.1852,,Jurisdiction covers Chinderi and surrounding areas,+233 358 722 315,chinderi.court@judicial.gov.gh,https://www.judicial.gov.gh,https://images.unsplash.com/photo-1589829545856-d10d557cf95f?w=500,,"{'monday': '9:00 AM - 5:00 PM', 'tuesday': '9:00 AM - 5:00 PM', 'wednesday': '9:00 AM - 5:00 PM', 'thursday': '9:00 AM - 5:00 PM', 'friday': '9:00 AM - 5:00 PM', 'saturday': '9:00 AM - 1:00 PM', 'sunday': 'Closed'}",True,True,2025-09-18 03:10:03,2025-09-18 03:22:34,,,0,,"Court located in Chinderi, Oti region",ACTIVE
206,Koforidua High Court,,High Court,Eastern,General,"Koforidua High Court, Koforidua, Eastern Region",,,6.1,-0.2667,,Jurisdiction covers General and surrounding areas,+233 342 020 123,koforidua.highcourt@judicial.gov.gh,https://www.judicial.gov.gh,https://images.unsplash.com/photo-1589829545856-d10d557cf95f?w=500,,"{'monday': '9:00 AM - 5:00 PM', 'tuesday': '9:00 AM - 5:00 PM', 'wednesday': '9:00 AM - 5:00 PM', 'thursday': '9:00 AM - 5:00 PM', 'friday': '9:00 AM - 5:00 PM', 'saturday': '9:00 AM - 1:00 PM', 'sunday': 'Closed'}",True,True,2025-09-18 03:10:03,2025-09-18 03:22:34,,,0,,"Court located in General, Eastern region",ACTIVE
208,Commercial Courts – A,,Unknown,Eastern,Unknown,"Commercial Courts – A, Unknown, Eastern",,,5.94414,-0.300956,,Jurisdiction covers Unknown and surrounding areas,+233 913 364 431,unknown.court@judicial.gov.gh,https://www.judicial.gov.gh,https://images.unsplash.com/photo-1589829545856-d10d557cf95f?w=500,,"{'monday': '9:00 AM - 5:00 PM', 'tuesday': '9:00 AM - 5:00 PM', 'wednesday': '9:00 AM - 5:00 PM', 'thursday': '9:00 AM - 5:00 PM', 'friday': '9:00 AM - 5:00 PM', 'saturday': '9:00 AM - 1:00 PM', 'sunday': 'Closed'}",True,True,2025-09-18 03:10:03,2025-09-18 03:22:34,,,0,,"Court located in Unknown, Eastern region",ACTIVE
210,Akim Oda High Court,,High Court,Eastern,Akim Oda,"Akim Oda High Court, Akim Oda, Eastern Region",,,5.9167,-0.9833,,Jurisdiction covers Akim Oda and surrounding areas,+233 342 030 123,akimoda.highcourt@judicial.gov.gh,https://www.judicial.gov.gh,https://images.unsplash.com/photo-1589829545856-d10d557cf95f?w=500,,"{'monday': '9:00 AM - 5:00 PM', 'tuesday': '9:00 AM - 5:00 PM', 'wednesday': '9:00 AM - 5:00 PM', 'thursday': '9:00 AM - 5:00 PM', 'friday': '9:00 AM - 5:00 PM', 'saturday': '9:00 AM - 1:00 PM', 'sunday': 'Closed'}",True,True,2025-09-18 03:10:03,2025-09-18 03:22:34,,,0,,"Court located in Akim Oda, Eastern region",ACTIVE
212,Nsawam High Court,,High Court,Eastern,Nsawam,"Nsawam High Court, Nsawam, Eastern",,,6.110132,-0.67514,,Jurisdiction covers Nsawam and surrounding areas,+233 797 455 363,nsawam.court@judicial.gov.gh,https://www.judicial.gov.gh,https://images.unsplash.com/photo-1589829545856-d10d557cf95f?w=500,,"{'monday': '9:00 AM - 5:00 PM', 'tuesday': '9:00 AM - 5:00 PM', 'wednesday': '9:00 AM - 5:00 PM', 'thursday': '9:00 AM - 5:00 PM', 'friday': '9:00 AM - 5:00 PM', 'saturday': '9:00 AM - 1:00 PM', 'sunday': 'Closed'}",True,True,2025-09-18 03:10:03,2025-09-18 03:22:34,,,0,,"Court located in Nsawam, Eastern region",ACTIVE
214,Somanya High Court,,High Court,Eastern,Somanya,"Somanya High Court, Somanya, Eastern",,,5.896535,-0.13466,,Jurisdiction covers Somanya and surrounding areas,+233 803 397 910,somanya.court@judicial.gov.gh,https://www.judicial.gov.gh,https://images.unsplash.com/photo-1589829545856-d10d557cf95f?w=500,,"{'monday': '9:00 AM - 5:00 PM', 'tuesday': '9:00 AM - 5:00 PM', 'wednesday': '9:00 AM - 5:00 PM', 'thursday': '9:00 AM - 5:00 PM', 'friday': '9:00 AM - 5:00 PM', 'saturday': '9:00 AM - 1:00 PM', 'sunday': 'Closed'}",True,True,2025-09-18 03:10:03,2025-09-18 03:22:34,,,0,,"Court located in Somanya, Eastern region",ACTIVE
215,Kibi High Court,,High Court,Eastern,Kibi,"Kibi High Court, Kibi, Eastern",,,6.132474,-0.252239,,Jurisdiction covers Kibi and surrounding areas,+233 686 492 513,kibi.court@judicial.gov.gh,https://www.judicial.gov.gh,https://images.unsplash.com/photo-1589829545856-d10d557cf95f?w=500,,"{'monday': '9:00 AM - 5:00 PM', 'tuesday': '9:00 AM - 5:00 PM', 'wednesday': '9:00 AM - 5:00 PM', 'thursday': '9:00 AM - 5:00 PM', 'friday': '9:00 AM - 5:00 PM', 'saturday': '9:00 AM - 1:00 PM', 'sunday': 'Closed'}",True,True,2025-09-18 03:10:03,2025-09-18 03:22:34,,,0,,"Court located in Kibi, Eastern region",ACTIVE
217,Koforidua Circuit Court – A,,Circuit Court,Eastern,GBVC,"Koforidua Circuit Court – A, GBVC, Eastern",,,5.747636,-0.225893,,Jurisdiction covers GBVC and surrounding areas,+233 206 698 552,gbvc.court@judicial.gov.gh,https://www.judicial.gov.gh,https://images.unsplash.com/photo-1589829545856-d10d557cf95f?w=500,,"{'monday': '9:00 AM - 5:00 PM', 'tuesday': '9:00 AM - 5:00 PM', 'wednesday': '9:00 AM - 5:00 PM', 'thursday': '9:00 AM - 5:00 PM', 'friday': '9:00 AM - 5:00 PM', 'saturday': '9:00 AM - 1:00 PM', 'sunday': 'Closed'}",True,True,2025-09-18 03:10:03,2025-09-18 03:22:34,,,0,,"Court located in GBVC, Eastern region",ACTIVE
219,Akropong Akwapim Circuit Court,,Circuit Court,Eastern,Akropong Akwapim,"Akropong Akwapim Circuit Court, Akropong Akwapim, Eastern",,,5.700493,0.073011,,Jurisdiction covers Akropong Akwapim and surrounding areas,+233 658 352 610,akropongakwapim.court@judicial.gov.gh,https://www.judicial.gov.gh,https://images.unsplash.com/photo-1589829545856-d10d557cf95f?w=500,,"{'monday': '9:00 AM - 5:00 PM', 'tuesday': '9:00 AM - 5:00 PM', 'wednesday': '9:00 AM - 5:00 PM', 'thursday': '9:00 AM - 5:00 PM', 'friday': '9:00 AM - 5:00 PM', 'saturday': '9:00 AM - 1:00 PM', 'sunday': 'Closed'}",True,True,2025-09-18 03:10:03,2025-09-18 03:22:34,,,0,,"Court located in Akropong Akwapim, Eastern region",ACTIVE
221,Mpraeso Circuit Court,,Circuit Court,Eastern,Mpraeso,"Mpraeso Circuit Court, Mpraeso, Eastern",,,6.158709,-0.741611,,Jurisdiction covers Mpraeso and surrounding areas,+233 548 917 571,mpraeso.court@judicial.gov.gh,https://www.judicial.gov.gh,https://images.unsplash.com/photo-1589829545856-d10d557cf95f?w=500,,"{'monday': '9:00 AM - 5:00 PM', 'tuesday': '9:00 AM - 5:00 PM', 'wednesday': '9:00 AM - 5:00 PM', 'thursday': '9:00 AM - 5:00 PM', 'friday': '9:00 AM - 5:00 PM', 'saturday': '9:00 AM - 1:00 PM', 'sunday': 'Closed'}",True,True,2025-09-18 03:10:03,2025-09-18 03:22:34,,,0,,"Court located in Mpraeso, Eastern region",ACTIVE
223,Odumase Krobo Circuit Court,,Circuit Court,Eastern,Odumase Krobo,"Odumase Krobo Circuit Court, Odumase Krobo, Eastern",,,5.653714,-0.493166,,Jurisdiction covers Odumase Krobo and surrounding areas,+233 571 885 236,odumasekrobo.court@judicial.gov.gh,https://www.judicial.gov.gh,https://images.unsplash.com/photo-1589829545856-d10d557cf95f?w=500,,"{'monday': '9:00 AM - 5:00 PM', 'tuesday': '9:00 AM - 5:00 PM', 'wednesday': '9:00 AM - 5:00 PM', 'thursday': '9:00 AM - 5:00 PM', 'friday': '9:00 AM - 5:00 PM', 'saturday': '9:00 AM - 1:00 PM', 'sunday': 'Closed'}",True,True,2025-09-18 03:10:03,2025-09-18 03:22:34,,,0,,"Court located in Odumase Krobo, Eastern region",ACTIVE
225,Anyinam Circuit Court,,Circuit Court,Eastern,Anyinam,"Anyinam Circuit Court, Anyinam, Eastern",,,6.140857,-0.280235,,Jurisdiction covers Anyinam and surrounding areas,+233 751 176 564,anyinam.court@judicial.gov.gh,https://www.judicial.gov.gh,https://images.unsplash.com/photo-1589829545856-d10d557cf95f?w=500,,"{'monday': '9:00 AM - 5:00 PM', 'tuesday': '9:00 AM - 5:00 PM', 'wednesday': '9:00 AM - 5:00 PM', 'thursday': '9:00 AM - 5:00 PM', 'friday': '9:00 AM - 5:00 PM', 'saturday': '9:00 AM - 1:00 PM', 'sunday': 'Closed'}",True,True,2025-09-18 03:10:03,2025-09-18 03:22:34,,,0,,"Court located in Anyinam, Eastern region",ACTIVE
227,Kibi Circuit Court,,Circuit Court,Eastern,Kibi,"Kibi Circuit Court, Kibi, Eastern",,,6.282415,-0.383623,,Jurisdiction covers Kibi and surrounding areas,+233 670 280 247,kibi.court@judicial.gov.gh,https://www.judicial.gov.gh,https://images.unsplash.com/photo-1589829545856-d10d557cf95f?w=500,,"{'monday': '9:00 AM - 5:00 PM', 'tuesday': '9:00 AM - 5:00 PM', 'wednesday': '9:00 AM - 5:00 PM', 'thursday': '9:00 AM - 5:00 PM', 'friday': '9:00 AM - 5:00 PM', 'saturday': '9:00 AM - 1:00 PM', 'sunday': 'Closed'}",True,True,2025-09-18 03:10:03,2025-09-18 03:22:34,,,0,,"Court located in Kibi, Eastern region",ACTIVE
229,New Abirem Circuit Court,,Circuit Court,Eastern,New Abirem,"New Abirem Circuit Court, New Abirem, Eastern",,,6.166406,0.09744,,Jurisdiction covers New Abirem and surrounding areas,+233 749 401 897,newabirem.court@judicial.gov.gh,https://www.judicial.gov.gh,https://images.unsplash.com/photo-1589829545856-d10d557cf95f?w=500,,"{'monday': '9:00 AM - 5:00 PM', 'tuesday': '9:00 AM - 5:00 PM', 'wednesday': '9:00 AM - 5:00 PM', 'thursday': '9:00 AM - 5:00 PM', 'friday': '9:00 AM - 5:00 PM', 'saturday': '9:00 AM - 1:00 PM', 'sunday': 'Closed'}",True,True,2025-09-18 03:10:03,2025-09-18 03:22:34,,,0,,"Court located in New Abirem, Eastern region",ACTIVE
231,Koforidua District Court – B,,District Court,Eastern,Koforidua,"Koforidua District Court – B, Koforidua, Eastern",,,5.638397,-0.349266,,Jurisdiction covers Koforidua and surrounding areas,+233 613 843 368,koforidua.court@judicial.gov.gh,https://www.judicial.gov.gh,https://images.unsplash.com/photo-1589829545856-d10d557cf95f?w=500,,"{'monday': '9:00 AM - 5:00 PM', 'tuesday': '9:00 AM - 5:00 PM', 'wednesday': '9:00 AM - 5:00 PM', 'thursday': '9:00 AM - 5:00 PM', 'friday': '9:00 AM - 5:00 PM', 'saturday': '9:00 AM - 1:00 PM', 'sunday': 'Closed'}",True,True,2025-09-18 03:10:03,2025-09-18 03:22:34,,,0,,"Court located in Koforidua, Eastern region",ACTIVE
233,Abetifi District Court,,District Court,Eastern,Abetifi,"Abetifi District Court, Abetifi, Eastern",,,5.889101,0.059611,,Jurisdiction covers Abetifi and surrounding areas,+233 880 918 410,abetifi.court@judicial.gov.gh,https://www.judicial.gov.gh,https://images.unsplash.com/photo-1589829545856-d10d557cf95f?w=500,,"{'monday': '9:00 AM - 5:00 PM', 'tuesday': '9:00 AM - 5:00 PM', 'wednesday': '9:00 AM - 5:00 PM', 'thursday': '9:00 AM - 5:00 PM', 'friday': '9:00 AM - 5:00 PM', 'saturday': '9:00 AM - 1:00 PM', 'sunday': 'Closed'}",True,True,2025-09-18 03:10:03,2025-09-18 03:22:34,,,0,,"Court located in Abetifi, Eastern region",ACTIVE
235,Akim Ofoase District Court,,District Court,Eastern,Akim Ofoase,"Akim Ofoase District Court, Akim Ofoase, Eastern",,,5.653179,0.065596,,Jurisdiction covers Akim Ofoase and surrounding areas,+233 669 608 767,akimofoase.court@judicial.gov.gh,https://www.judicial.gov.gh,https://images.unsplash.com/photo-1589829545856-d10d557cf95f?w=500,,"{'monday': '9:00 AM - 5:00 PM', 'tuesday': '9:00 AM - 5:00 PM', 'wednesday': '9:00 AM - 5:00 PM', 'thursday': '9:00 AM - 5:00 PM', 'friday': '9:00 AM - 5:00 PM', 'saturday': '9:00 AM - 1:00 PM', 'sunday': 'Closed'}",True,True,2025-09-18 03:10:03,2025-09-18 03:22:34,,,0,,"Court located in Akim Ofoase, Eastern region",ACTIVE
237,Asesewa District Court,,District Court,Eastern,Asesewa,"Asesewa District Court, Asesewa, Eastern",,,6.317976,-0.497005,,Jurisdiction covers Asesewa and surrounding areas,+233 971 799 287,asesewa.court@judicial.gov.gh,https://www.judicial.gov.gh,https://images.unsplash.com/photo-1589829545856-d10d557cf95f?w=500,,"{'monday': '9:00 AM - 5:00 PM', 'tuesday': '9:00 AM - 5:00 PM', 'wednesday': '9:00 AM - 5:00 PM', 'thursday': '9:00 AM - 5:00 PM', 'friday': '9:00 AM - 5:00 PM', 'saturday': '9:00 AM - 1:00 PM', 'sunday': 'Closed'}",True,True,2025-09-18 03:10:03,2025-09-18 03:22:34,,,0,,"Court located in Asesewa, Eastern region",ACTIVE
216,Odumase Krobo High Court,,High Court,Eastern,Odumase Krobo,"Odumase Krobo High Court, Odumase Krobo, Eastern",,,6.308389,-0.447966,,Jurisdiction covers Odumase Krobo and surrounding areas,+233 247 227 575,odumasekrobo.court@judicial.gov.gh,https://www.judicial.gov.gh,https://images.unsplash.com/photo-1589829545856-d10d557cf95f?w=500,,"{'monday': '9:00 AM - 5:00 PM', 'tuesday': '9:00 AM - 5:00 PM', 'wednesday': '9:00 AM - 5:00 PM', 'thursday': '9:00 AM - 5:00 PM', 'friday': '9:00 AM - 5:00 PM', 'saturday': '9:00 AM - 1:00 PM', 'sunday': 'Closed'}",True,True,2025-09-18 03:10:03,2025-09-18 03:22:34,,,0,,"Court located in Odumase Krobo, Eastern region",ACTIVE
218,Koforidua Circuit Court – B,,Circuit Court,Eastern,Koforidua,"Koforidua Circuit Court – B, Koforidua, Eastern",,,6.371279,-0.100279,,Jurisdiction covers Koforidua and surrounding areas,+233 341 885 655,koforidua.court@judicial.gov.gh,https://www.judicial.gov.gh,https://images.unsplash.com/photo-1589829545856-d10d557cf95f?w=500,,"{'monday': '9:00 AM - 5:00 PM', 'tuesday': '9:00 AM - 5:00 PM', 'wednesday': '9:00 AM - 5:00 PM', 'thursday': '9:00 AM - 5:00 PM', 'friday': '9:00 AM - 5:00 PM', 'saturday': '9:00 AM - 1:00 PM', 'sunday': 'Closed'}",True,True,2025-09-18 03:10:03,2025-09-18 03:22:34,,,0,,"Court located in Koforidua, Eastern region",ACTIVE
220,Asamankese Circuit Court,,Circuit Court,Eastern,Asamankese,"Asamankese Circuit Court, Asamankese, Eastern",,,6.154241,-0.514865,,Jurisdiction covers Asamankese and surrounding areas,+233 574 212 422,asamankese.court@judicial.gov.gh,https://www.judicial.gov.gh,https://images.unsplash.com/photo-1589829545856-d10d557cf95f?w=500,,"{'monday': '9:00 AM - 5:00 PM', 'tuesday': '9:00 AM - 5:00 PM', 'wednesday': '9:00 AM - 5:00 PM', 'thursday': '9:00 AM - 5:00 PM', 'friday': '9:00 AM - 5:00 PM', 'saturday': '9:00 AM - 1:00 PM', 'sunday': 'Closed'}",True,True,2025-09-18 03:10:03,2025-09-18 03:22:34,,,0,,"Court located in Asamankese, Eastern region",ACTIVE
222,Nsawam Circuit Court,,Circuit Court,Eastern,Nsawam,"Nsawam Circuit Court, Nsawam, Eastern",,,6.307551,-0.213865,,Jurisdiction covers Nsawam and surrounding areas,+233 473 343 525,nsawam.court@judicial.gov.gh,https://www.judicial.gov.gh,https://images.unsplash.com/photo-1589829545856-d10d557cf95f?w=500,,"{'monday': '9:00 AM - 5:00 PM', 'tuesday': '9:00 AM - 5:00 PM', 'wednesday': '9:00 AM - 5:00 PM', 'thursday': '9:00 AM - 5:00 PM', 'friday': '9:00 AM - 5:00 PM', 'saturday': '9:00 AM - 1:00 PM', 'sunday': 'Closed'}",True,True,2025-09-18 03:10:03,2025-09-18 03:22:34,,,0,,"Court located in Nsawam, Eastern region",ACTIVE
224,Akim Swedru Circuit Court,,Circuit Court,Eastern,Akim Swedru,"Akim Swedru Circuit Court, Akim Swedru, Eastern",,,5.660041,0.022322,,Jurisdiction covers Akim Swedru and surrounding areas,+233 600 926 871,akimswedru.court@judicial.gov.gh,https://www.judicial.gov.gh,https://images.unsplash.com/photo-1589829545856-d10d557cf95f?w=500,,"{'monday': '9:00 AM - 5:00 PM', 'tuesday': '9:00 AM - 5:00 PM', 'wednesday': '9:00 AM - 5:00 PM', 'thursday': '9:00 AM - 5:00 PM', 'friday': '9:00 AM - 5:00 PM', 'saturday': '9:00 AM - 1:00 PM', 'sunday': 'Closed'}",True,True,2025-09-18 03:10:03,2025-09-18 03:22:34,,,0,,"Court located in Akim Swedru, Eastern region",ACTIVE
226,Suhum Circuit Court,,Circuit Court,Eastern,Suhum,"Suhum Circuit Court, Suhum, Eastern",,,5.911005,-0.35055,,Jurisdiction covers Suhum and surrounding areas,+233 856 615 185,suhum.court@judicial.gov.gh,https://www.judicial.gov.gh,https://images.unsplash.com/photo-1589829545856-d10d557cf95f?w=500,,"{'monday': '9:00 AM - 5:00 PM', 'tuesday': '9:00 AM - 5:00 PM', 'wednesday': '9:00 AM - 5:00 PM', 'thursday': '9:00 AM - 5:00 PM', 'friday': '9:00 AM - 5:00 PM', 'saturday': '9:00 AM - 1:00 PM', 'sunday': 'Closed'}",True,True,2025-09-18 03:10:03,2025-09-18 03:22:34,,,0,,"Court located in Suhum, Eastern region",ACTIVE
228,Nkwatia Circuit Court,,Circuit Court,Eastern,Nkwatia,"Nkwatia Circuit Court, Nkwatia, Eastern",,,6.499445,-0.669871,,Jurisdiction covers Nkwatia and surrounding areas,+233 630 483 364,nkwatia.court@judicial.gov.gh,https://www.judicial.gov.gh,https://images.unsplash.com/photo-1589829545856-d10d557cf95f?w=500,,"{'monday': '9:00 AM - 5:00 PM', 'tuesday': '9:00 AM - 5:00 PM', 'wednesday': '9:00 AM - 5:00 PM', 'thursday': '9:00 AM - 5:00 PM', 'friday': '9:00 AM - 5:00 PM', 'saturday': '9:00 AM - 1:00 PM', 'sunday': 'Closed'}",True,True,2025-09-18 03:10:03,2025-09-18 03:22:34,,,0,,"Court located in Nkwatia, Eastern region",ACTIVE
230,Koforidua District Court – A,,District Court,Eastern,Koforidua,"Koforidua District Court – A, Koforidua, Eastern",,,6.535352,-0.667238,,Jurisdiction covers Koforidua and surrounding areas,+233 698 758 720,koforidua.court@judicial.gov.gh,https://www.judicial.gov.gh,https://images.unsplash.com/photo-1589829545856-d10d557cf95f?w=500,,"{'monday': '9:00 AM - 5:00 PM', 'tuesday': '9:00 AM - 5:00 PM', 'wednesday': '9:00 AM - 5:00 PM', 'thursday': '9:00 AM - 5:00 PM', 'friday': '9:00 AM - 5:00 PM', 'saturday': '9:00 AM - 1:00 PM', 'sunday': 'Closed'}",True,True,2025-09-18 03:10:03,2025-09-18 03:22:34,,,0,,"Court located in Koforidua, Eastern region",ACTIVE
232,New Tafo District Court,,District Court,Eastern,New Tafo,"New Tafo District Court, New Tafo, Eastern",,,6.22828,-0.407029,,Jurisdiction covers New Tafo and surrounding areas,+233 414 529 359,newtafo.court@judicial.gov.gh,https://www.judicial.gov.gh,https://images.unsplash.com/photo-1589829545856-d10d557cf95f?w=500,,"{'monday': '9:00 AM - 5:00 PM', 'tuesday': '9:00 AM - 5:00 PM', 'wednesday': '9:00 AM - 5:00 PM', 'thursday': '9:00 AM - 5:00 PM', 'friday': '9:00 AM - 5:00 PM', 'saturday': '9:00 AM - 1:00 PM', 'sunday': 'Closed'}",True,True,2025-09-18 03:10:03,2025-09-18 03:22:34,,,0,,"Court located in New Tafo, Eastern region",ACTIVE
234,Akim Oda District Court,,District Court,Eastern,Akim Oda,"Akim Oda District Court, Akim Oda, Eastern",,,6.102299,-0.496661,,Jurisdiction covers Akim Oda and surrounding areas,+233 356 656 701,akimoda.court@judicial.gov.gh,https://www.judicial.gov.gh,https://images.unsplash.com/photo-1589829545856-d10d557cf95f?w=500,,"{'monday': '9:00 AM - 5:00 PM', 'tuesday': '9:00 AM - 5:00 PM', 'wednesday': '9:00 AM - 5:00 PM', 'thursday': '9:00 AM - 5:00 PM', 'friday': '9:00 AM - 5:00 PM', 'saturday': '9:00 AM - 1:00 PM', 'sunday': 'Closed'}",True,True,2025-09-18 03:10:03,2025-09-18 03:22:34,,,0,,"Court located in Akim Oda, Eastern region",ACTIVE
236,Asamankese District Court,,District Court,Eastern,Asamankese,"Asamankese District Court, Asamankese, Eastern",,,6.005795,0.197498,,Jurisdiction covers Asamankese and surrounding areas,+233 510 480 304,asamankese.court@judicial.gov.gh,https://www.judicial.gov.gh,https://images.unsplash.com/photo-1589829545856-d10d557cf95f?w=500,,"{'monday': '9:00 AM - 5:00 PM', 'tuesday': '9:00 AM - 5:00 PM', 'wednesday': '9:00 AM - 5:00 PM', 'thursday': '9:00 AM - 5:00 PM', 'friday': '9:00 AM - 5:00 PM', 'saturday': '9:00 AM - 1:00 PM', 'sunday': 'Closed'}",True,True,2025-09-18 03:10:03,2025-09-18 03:22:34,,,0,,"Court located in Asamankese, Eastern region",ACTIVE
238,Begoro District Court,,District Court,Eastern,Begoro,"Begoro District Court, Begoro, Eastern",,,5.751012,-0.143496,,Jurisdiction covers Begoro and surrounding areas,+233 622 481 436,begoro.court@judicial.gov.gh,https://www.judicial.gov.gh,https://images.unsplash.com/photo-1589829545856-d10d557cf95f?w=500,,"{'monday': '9:00 AM - 5:00 PM', 'tuesday': '9:00 AM - 5:00 PM', 'wednesday': '9:00 AM - 5:00 PM', 'thursday': '9:00 AM - 5:00 PM', 'friday': '9:00 AM - 5:00 PM', 'saturday': '9:00 AM - 1:00 PM', 'sunday': 'Closed'}",True,True,2025-09-18 03:10:03,2025-09-18 03:22:34,,,0,,"Court located in Begoro, Eastern region",ACTIVE
239,Donkorkrom District Court,,District Court,Eastern,Donkorkrom,"Donkorkrom District Court, Donkorkrom, Eastern",,,6.37891,-0.309228,,Jurisdiction covers Donkorkrom and surrounding areas,+233 559 203 491,donkorkrom.court@judicial.gov.gh,https://www.judicial.gov.gh,https://images.unsplash.com/photo-1589829545856-d10d557cf95f?w=500,,"{'monday': '9:00 AM - 5:00 PM', 'tuesday': '9:00 AM - 5:00 PM', 'wednesday': '9:00 AM - 5:00 PM', 'thursday': '9:00 AM - 5:00 PM', 'friday': '9:00 AM - 5:00 PM', 'saturday': '9:00 AM - 1:00 PM', 'sunday': 'Closed'}",True,True,2025-09-18 03:10:03,2025-09-18 03:22:34,,,0,,"Court located in Donkorkrom, Eastern region",ACTIVE
241,Kibi District Court,,District Court,Eastern,Kibi,"Kibi District Court, Kibi, Eastern",,,6.165612,-0.028464,,Jurisdiction covers Kibi and surrounding areas,+233 738 706 797,kibi.court@judicial.gov.gh,https://www.judicial.gov.gh,https://images.unsplash.com/photo-1589829545856-d10d557cf95f?w=500,,"{'monday': '9:00 AM - 5:00 PM', 'tuesday': '9:00 AM - 5:00 PM', 'wednesday': '9:00 AM - 5:00 PM', 'thursday': '9:00 AM - 5:00 PM', 'friday': '9:00 AM - 5:00 PM', 'saturday': '9:00 AM - 1:00 PM', 'sunday': 'Closed'}",True,True,2025-09-18 03:10:03,2025-09-18 03:22:34,,,0,,"Court located in Kibi, Eastern region",ACTIVE
243,Mampong Akwapim District Court,,District Court,Eastern,Mampong Akwapim,"Mampong Akwapim District Court, Mampong Akwapim, Eastern",,,6.171458,0.158725,,Jurisdiction covers Mampong Akwapim and surrounding areas,+233 975 789 245,mampongakwapim.court@judicial.gov.gh,https://www.judicial.gov.gh,https://images.unsplash.com/photo-1589829545856-d10d557cf95f?w=500,,"{'monday': '9:00 AM - 5:00 PM', 'tuesday': '9:00 AM - 5:00 PM', 'wednesday': '9:00 AM - 5:00 PM', 'thursday': '9:00 AM - 5:00 PM', 'friday': '9:00 AM - 5:00 PM', 'saturday': '9:00 AM - 1:00 PM', 'sunday': 'Closed'}",True,True,2025-09-18 03:10:03,2025-09-18 03:22:34,,,0,,"Court located in Mampong Akwapim, Eastern region",ACTIVE
245,Nsawam District Court,,District Court,Eastern,Nsawam,"Nsawam District Court, Nsawam, Eastern",,,6.184488,-0.419144,,Jurisdiction covers Nsawam and surrounding areas,+233 931 522 281,nsawam.court@judicial.gov.gh,https://www.judicial.gov.gh,https://images.unsplash.com/photo-1589829545856-d10d557cf95f?w=500,,"{'monday': '9:00 AM - 5:00 PM', 'tuesday': '9:00 AM - 5:00 PM', 'wednesday': '9:00 AM - 5:00 PM', 'thursday': '9:00 AM - 5:00 PM', 'friday': '9:00 AM - 5:00 PM', 'saturday': '9:00 AM - 1:00 PM', 'sunday': 'Closed'}",True,True,2025-09-18 03:10:03,2025-09-18 03:22:34,,,0,,"Court located in Nsawam, Eastern region",ACTIVE
247,Somanya District Court,,District Court,Eastern,Somanya,"Somanya District Court, Somanya, Eastern",,,6.079644,-0.118983,,Jurisdiction covers Somanya and surrounding areas,+233 544 933 670,somanya.court@judicial.gov.gh,https://www.judicial.gov.gh,https://images.unsplash.com/photo-1589829545856-d10d557cf95f?w=500,,"{'monday': '9:00 AM - 5:00 PM', 'tuesday': '9:00 AM - 5:00 PM', 'wednesday': '9:00 AM - 5:00 PM', 'thursday': '9:00 AM - 5:00 PM', 'friday': '9:00 AM - 5:00 PM', 'saturday': '9:00 AM - 1:00 PM', 'sunday': 'Closed'}",True,True,2025-09-18 03:10:03,2025-09-18 03:22:34,,,0,,"Court located in Somanya, Eastern region",ACTIVE
249,New Abirem District Court,,District Court,Eastern,New Abirem,"New Abirem District Court, New Abirem, Eastern",,,6.539997,-0.011445,,Jurisdiction covers New Abirem and surrounding areas,+233 849 768 723,newabirem.court@judicial.gov.gh,https://www.judicial.gov.gh,https://images.unsplash.com/photo-1589829545856-d10d557cf95f?w=500,,"{'monday': '9:00 AM - 5:00 PM', 'tuesday': '9:00 AM - 5:00 PM', 'wednesday': '9:00 AM - 5:00 PM', 'thursday': '9:00 AM - 5:00 PM', 'friday': '9:00 AM - 5:00 PM', 'saturday': '9:00 AM - 1:00 PM', 'sunday': 'Closed'}",True,True,2025-09-18 03:10:03,2025-09-18 03:22:34,,,0,,"Court located in New Abirem, Eastern region",ACTIVE
